[
  {
    "id": "sample-online-course",
    "name": "샘플: 공공 온라인 강좌",
    "operator": "샘플 기관",
    "official_url": "https://example.com/",
    "apply_url": "",
    "kinds": ["무료교육"],
    "fields": ["전분야"],
    "regions": ["전국"],
    "age_min": null, "age_max": null,
    "education": "제한없음", "education_note": "",
    "income": "제한없음", "income_pct_max": null, "income_note": "",
    "allow_job_seeker": "가능", "allow_employed": "가능", "allow_business": "가능", "allow_student": "가능",
    "other_conditions": "",
    "cost": "없음", "money": "없음", "money_monthly_max_manwon": null,
    "format": "온라인", "recruit": "상시", "next_deadline": null,
    "summary": "개발용 샘플입니다. 실제 제도가 아닙니다.",
    "sources": [{ "url": "https://example.com/", "quote": "샘플" }],
    "origin": "manual", "checked_at": "2026-09-15"
  },
  {
    "id": "sample-youth-allowance",
    "name": "샘플: 청년 교육 수당",
    "operator": "샘플 시청",
    "official_url": "https://example.com/",
    "apply_url": "https://example.com/apply",
    "kinds": ["돈받는교육", "지원금"],
    "fields": ["IT·AI", "영상·디자인"],
    "regions": ["서울"],
    "age_min": 19, "age_max": 34,
    "education": "고졸이상", "education_note": "고등학교 졸업 이상",
    "income": "기준있음", "income_pct_max": 150, "income_note": "가구 기준중위소득 150% 이하",
    "allow_job_seeker": "가능", "allow_employed": "불가", "allow_business": "확인필요", "allow_student": "불가",
    "other_conditions": "서울 6개월 이상 거주",
    "cost": "없음", "money": "월 50만원 × 6개월", "money_monthly_max_manwon": 50,
    "format": "주간", "recruit": "매년 3월", "next_deadline": "2026-10-02",
    "summary": "개발용 샘플입니다. 실제 제도가 아닙니다.",
    "sources": [{ "url": "https://example.com/", "quote": "샘플" }],
    "origin": "manual", "checked_at": "2026-09-15"
  },
  {
    "id": "sample-exam-fee",
    "name": "샘플: 자격증 응시료 지원",
    "operator": "샘플 도청",
    "official_url": "https://example.com/",
    "apply_url": "",
    "kinds": ["응시료"],
    "fields": ["전분야"],
    "regions": ["경기 성남시"],
    "age_min": 18, "age_max": 39,
    "education": "확인필요", "education_note": "",
    "income": "제한없음", "income_pct_max": null, "income_note": "",
    "allow_job_seeker": "가능", "allow_employed": "확인필요", "allow_business": "불가", "allow_student": "가능",
    "other_conditions": "",
    "cost": "응시료 먼저 낸 뒤 환급", "money": "연 20만원까지", "money_monthly_max_manwon": null,
    "format": "해당 없음", "recruit": "분기별", "next_deadline": "2026-09-20",
    "summary": "개발용 샘플입니다. 실제 제도가 아닙니다.",
    "sources": [{ "url": "https://example.com/", "quote": "샘플" }],
    "origin": "manual", "checked_at": "2026-09-15"
  },
  {
    "id": "sample-senior-startup",
    "name": "샘플: 중장년 창업 교육",
    "operator": "샘플 재단",
    "official_url": "https://example.com/",
    "apply_url": "",
    "kinds": ["창업", "무료교육"],
    "fields": ["사무·회계·경영"],
    "regions": ["전국"],
    "age_min": 40, "age_max": null,
    "education": "제한없음", "education_note": "",
    "income": "확인필요", "income_pct_max": null, "income_note": "",
    "allow_job_seeker": "가능", "allow_employed": "가능", "allow_business": "가능", "allow_student": "확인필요",
    "other_conditions": "",
    "cost": "없음", "money": "사업화 자금 최대 1,000만원", "money_monthly_max_manwon": null,
    "format": "주말", "recruit": "연 2회", "next_deadline": null,
    "summary": "개발용 샘플입니다. 실제 제도가 아닙니다.",
    "sources": [{ "url": "https://example.com/", "quote": "샘플" }],
    "origin": "manual", "checked_at": "2026-09-15"
  }
]
